{
  "attempt": {
    "attemptNumber": 1,
    "idempotencyKey": "idempotency.slice06.open-diagnostic.export.649084bb143bfd8c.r3.a1",
    "partition": "diagnostic",
    "repetition": 3,
    "runId": "run.diagnostic.s06.export.v0.6.0",
    "sourceId": "source.s06.export.diagnostic.002"
  },
  "contentHash": "953426ff39e62e50a19e676e267346d4bb6dcbc0f0a1b2c33534bf3db0267821",
  "diagnosticEnvelopeRef": {
    "contentHash": "d59e511d526d8b0692fb285c28fa537e2c1db7c67d82c8ff5960ccfc6b77e916",
    "id": "diagnostic-envelope.2b57b8b42b7d932d5fac45bbdf2516583a0576d3c4994152233e7ab89a41769d",
    "relativePath": "quarantine/export/source.s06.export.diagnostic.002/r3/diagnostic-envelope.json"
  },
  "diagnosticFacts": {
    "candidateOutputByteLength": 1043,
    "candidateOutputDecodedPixelSha256": "6384cb99d73381f3b43ffc2a2143692ba716350acd0bf736624be08f7b9e1731",
    "candidateOutputFileSha256": "731639bd00c61b0c64edb0bd457cff2d37b4b881d89a74726b0be015913226a9",
    "oracleFindingCodes": [
      "S06_ORACLE_EXPECTED_IDENTITY_MISMATCH",
      "S06_ORACLE_PNG_METADATA_FORBIDDEN",
      "S06_ORACLE_PNG_SRGB_REQUIRED"
    ],
    "oraclePrimaryCode": "S06_ORACLE_PNG_SRGB_REQUIRED",
    "strictDecision": "non-pass",
    "telemetryComplete": true,
    "workerExitCode": 0,
    "workerExitConfirmed": true,
    "workerExitSignal": null,
    "workerRuntimePayloadSha256": "dbeba889048bc7e9200b99ab0e710b1365c292be267d9bab982e67afad8e8be3"
  },
  "evidenceBoundary": {
    "c1": 0,
    "calibrationAuthorized": false,
    "e1": 0,
    "excludedFromGateB": true,
    "formal": false,
    "g1": 0,
    "gateBDecisionAuthority": false,
    "o1": 0,
    "productSupport": false,
    "r1Pipeline": 0,
    "r1ProductRelease": 0,
    "r1ProductValidation": 0,
    "releaseAllowlist": "none",
    "releaseApproved": 0,
    "releaseRegistered": 0,
    "u1": 0,
    "v1": 0
  },
  "expectedDisposition": "applicable",
  "expectedStableErrorCode": null,
  "finishedAt": "2026-08-15T10:21:27.861Z",
  "idempotencyKeyHash": "2b57b8b42b7d932d5fac45bbdf2516583a0576d3c4994152233e7ab89a41769d",
  "mode": "open-diagnostic",
  "operation": "export",
  "publication": {
    "atomicDirectoryCommit": true,
    "rolePaths": {
      "candidateOutput": "quarantine/export/source.s06.export.diagnostic.002/r3/candidate-output.bin",
      "candidateOutputObservation": "quarantine/export/source.s06.export.diagnostic.002/r3/candidate-output-observation.json",
      "diagnosticEnvelope": "quarantine/export/source.s06.export.diagnostic.002/r3/diagnostic-envelope.json",
      "oracleDiagnostic": "quarantine/export/source.s06.export.diagnostic.002/r3/oracle-diagnostic.json",
      "terminalResult": "quarantine/export/source.s06.export.diagnostic.002/r3/terminal-result.json"
    },
    "rootRelativePath": "quarantine/export/source.s06.export.diagnostic.002/r3"
  },
  "reasonCode": "S06_OUTPUT_ORACLE_REJECTED",
  "requestRef": {
    "contentHash": "3572b4aea216c8f965341d37be320f2b5bcc5d7d5ab80620f0d77534784e0e6e",
    "id": "request.open-diagnostic.export.649084bb143bfd8c.r3.a1"
  },
  "resultId": "result.2b57b8b42b7d932d5fac45bbdf2516583a0576d3c4994152233e7ab89a41769d",
  "schemaVersion": "run-result.slice06.v0",
  "startedAt": "2026-08-15T10:21:27.651Z",
  "status": "characterized-oracle-non-pass",
  "workerFailureEnvelopeRef": null,
  "workerInvoked": true
}
