{
  "attempt": {
    "attemptNumber": 1,
    "idempotencyKey": "idempotency.slice06.open-diagnostic.export.022511f20daa0fe9.r3.a1",
    "partition": "diagnostic",
    "repetition": 3,
    "runId": "run.diagnostic.s06.export.v0.6.0",
    "sourceId": "source.s06.export.diagnostic.001"
  },
  "contentHash": "5cc6a57efa51453ce0b7bbc5507ff3cb8d46aad51b587e7be1b45170b66bc32c",
  "diagnosticEnvelopeRef": {
    "contentHash": "d32883e0dec3e30dc7eb4d0435af1711a93627036d99cf500332a18b0e51b4df",
    "id": "diagnostic-envelope.88107eac1936b6e9bdf8f8d937c87592ea6cac20ff04870f1cdaa23acbf4626a",
    "relativePath": "quarantine/export/source.s06.export.diagnostic.001/r3/diagnostic-envelope.json"
  },
  "diagnosticFacts": {
    "candidateOutputByteLength": 800,
    "candidateOutputDecodedPixelSha256": "bbc41256a04bc2a1fc3b2192d861471706b301433b79fe2c8170ad732cae139d",
    "candidateOutputFileSha256": "8fb94ebbc655d666a36e8b3549c1b6d2aff5a30517175a200f1c738d6d37327c",
    "oracleFindingCodes": [
      "S06_ORACLE_EXPECTED_IDENTITY_MISMATCH",
      "S06_ORACLE_PNG_METADATA_FORBIDDEN",
      "S06_ORACLE_PNG_SRGB_REQUIRED"
    ],
    "oraclePrimaryCode": "S06_ORACLE_PNG_SRGB_REQUIRED",
    "strictDecision": "non-pass",
    "telemetryComplete": true,
    "workerExitCode": 0,
    "workerExitConfirmed": true,
    "workerExitSignal": null,
    "workerRuntimePayloadSha256": "dbeba889048bc7e9200b99ab0e710b1365c292be267d9bab982e67afad8e8be3"
  },
  "evidenceBoundary": {
    "c1": 0,
    "calibrationAuthorized": false,
    "e1": 0,
    "excludedFromGateB": true,
    "formal": false,
    "g1": 0,
    "gateBDecisionAuthority": false,
    "o1": 0,
    "productSupport": false,
    "r1Pipeline": 0,
    "r1ProductRelease": 0,
    "r1ProductValidation": 0,
    "releaseAllowlist": "none",
    "releaseApproved": 0,
    "releaseRegistered": 0,
    "u1": 0,
    "v1": 0
  },
  "expectedDisposition": "applicable",
  "expectedStableErrorCode": null,
  "finishedAt": "2026-08-15T10:21:27.254Z",
  "idempotencyKeyHash": "88107eac1936b6e9bdf8f8d937c87592ea6cac20ff04870f1cdaa23acbf4626a",
  "mode": "open-diagnostic",
  "operation": "export",
  "publication": {
    "atomicDirectoryCommit": true,
    "rolePaths": {
      "candidateOutput": "quarantine/export/source.s06.export.diagnostic.001/r3/candidate-output.bin",
      "candidateOutputObservation": "quarantine/export/source.s06.export.diagnostic.001/r3/candidate-output-observation.json",
      "diagnosticEnvelope": "quarantine/export/source.s06.export.diagnostic.001/r3/diagnostic-envelope.json",
      "oracleDiagnostic": "quarantine/export/source.s06.export.diagnostic.001/r3/oracle-diagnostic.json",
      "terminalResult": "quarantine/export/source.s06.export.diagnostic.001/r3/terminal-result.json"
    },
    "rootRelativePath": "quarantine/export/source.s06.export.diagnostic.001/r3"
  },
  "reasonCode": "S06_OUTPUT_ORACLE_REJECTED",
  "requestRef": {
    "contentHash": "f9c1d0faa59b2d216fce2efdb5b4dce73b46567e3fefdee7bee14d6f124b4326",
    "id": "request.open-diagnostic.export.022511f20daa0fe9.r3.a1"
  },
  "resultId": "result.88107eac1936b6e9bdf8f8d937c87592ea6cac20ff04870f1cdaa23acbf4626a",
  "schemaVersion": "run-result.slice06.v0",
  "startedAt": "2026-08-15T10:21:27.075Z",
  "status": "characterized-oracle-non-pass",
  "workerFailureEnvelopeRef": null,
  "workerInvoked": true
}
