{
  "attempt": {
    "attemptNumber": 1,
    "idempotencyKey": "idempotency.slice06.open-diagnostic.normalize.53b713ab2752987d.r2.a1",
    "partition": "diagnostic",
    "repetition": 2,
    "runId": "run.diagnostic.s06.normalize.v0.6.0",
    "sourceId": "source.s06.normalize.diagnostic.002"
  },
  "contentHash": "afb6d34654bdc16bddbf4469e00b4a36d070b9608b23d4d514bd50b22d7e8b12",
  "diagnosticEnvelopeRef": {
    "contentHash": "e4d956b704fbff7964d5dff51fc4fa7c973cf2e8c3690b792351e35116a93a4f",
    "id": "diagnostic-envelope.8f4d914ff8acda337824cee74f59ba77e57019c036952a7954d324427fbdc79b",
    "relativePath": "quarantine/normalize/source.s06.normalize.diagnostic.002/r2/diagnostic-envelope.json"
  },
  "diagnosticFacts": {
    "candidateOutputByteLength": 1043,
    "candidateOutputDecodedPixelSha256": "cbe7e8f4cf08cd859a040c77e7163246a0de03fdae25a11be6d4a0d91967d7c4",
    "candidateOutputFileSha256": "0d545d706d65dcd9689aacf51dbcfa81866561ee6b7b089f3a7cfbe34486ee79",
    "oracleFindingCodes": [
      "S06_ORACLE_EXPECTED_IDENTITY_MISMATCH",
      "S06_ORACLE_PNG_METADATA_FORBIDDEN",
      "S06_ORACLE_PNG_SRGB_REQUIRED"
    ],
    "oraclePrimaryCode": "S06_ORACLE_PNG_SRGB_REQUIRED",
    "strictDecision": "non-pass",
    "telemetryComplete": true,
    "workerExitCode": 0,
    "workerExitConfirmed": true,
    "workerExitSignal": null,
    "workerRuntimePayloadSha256": "dbeba889048bc7e9200b99ab0e710b1365c292be267d9bab982e67afad8e8be3"
  },
  "evidenceBoundary": {
    "c1": 0,
    "calibrationAuthorized": false,
    "e1": 0,
    "excludedFromGateB": true,
    "formal": false,
    "g1": 0,
    "gateBDecisionAuthority": false,
    "o1": 0,
    "productSupport": false,
    "r1Pipeline": 0,
    "r1ProductRelease": 0,
    "r1ProductValidation": 0,
    "releaseAllowlist": "none",
    "releaseApproved": 0,
    "releaseRegistered": 0,
    "u1": 0,
    "v1": 0
  },
  "expectedDisposition": "applicable",
  "expectedStableErrorCode": null,
  "finishedAt": "2026-08-15T10:21:25.641Z",
  "idempotencyKeyHash": "8f4d914ff8acda337824cee74f59ba77e57019c036952a7954d324427fbdc79b",
  "mode": "open-diagnostic",
  "operation": "normalize",
  "publication": {
    "atomicDirectoryCommit": true,
    "rolePaths": {
      "candidateOutput": "quarantine/normalize/source.s06.normalize.diagnostic.002/r2/candidate-output.bin",
      "candidateOutputObservation": "quarantine/normalize/source.s06.normalize.diagnostic.002/r2/candidate-output-observation.json",
      "diagnosticEnvelope": "quarantine/normalize/source.s06.normalize.diagnostic.002/r2/diagnostic-envelope.json",
      "oracleDiagnostic": "quarantine/normalize/source.s06.normalize.diagnostic.002/r2/oracle-diagnostic.json",
      "terminalResult": "quarantine/normalize/source.s06.normalize.diagnostic.002/r2/terminal-result.json"
    },
    "rootRelativePath": "quarantine/normalize/source.s06.normalize.diagnostic.002/r2"
  },
  "reasonCode": "S06_OUTPUT_ORACLE_REJECTED",
  "requestRef": {
    "contentHash": "2b5de42a272b7dff6f85e0f55fe7166336e18081be4112a22f22588957fedb06",
    "id": "request.open-diagnostic.normalize.53b713ab2752987d.r2.a1"
  },
  "resultId": "result.8f4d914ff8acda337824cee74f59ba77e57019c036952a7954d324427fbdc79b",
  "schemaVersion": "run-result.slice06.v0",
  "startedAt": "2026-08-15T10:21:25.460Z",
  "status": "characterized-oracle-non-pass",
  "workerFailureEnvelopeRef": null,
  "workerInvoked": true
}
