{
  "attempt": {
    "attemptNumber": 1,
    "idempotencyKey": "idempotency.slice06.open-diagnostic.export.ec69ed400703b349.r3.a1",
    "partition": "diagnostic",
    "repetition": 3,
    "runId": "run.diagnostic.s06.export.v0.6.0",
    "sourceId": "source.s06.export.diagnostic.003"
  },
  "contentHash": "98ce5340078bd2ddefb182e1180217e6c783b8ea43ae93150ba89807cf69cb8a",
  "diagnosticEnvelopeRef": {
    "contentHash": "f864fbdfe3b800d791c6731d37eac4b2daa6f1db98c3d9b4f983829f6f53a87d",
    "id": "diagnostic-envelope.2f57df4c298b2e57bf8d8b2841c71e4cd5184b9f1d560cd2ec8dd4a23a02898e",
    "relativePath": "quarantine/export/source.s06.export.diagnostic.003/r3/diagnostic-envelope.json"
  },
  "diagnosticFacts": {
    "candidateOutputByteLength": 790,
    "candidateOutputDecodedPixelSha256": "2ed8bd693af92a89f5d825ba88c46eb1b1c8f2489a3a294a132ea77591cb7a72",
    "candidateOutputFileSha256": "84b515b35836a10a53921fedc091ca8ab86d93a3e8b82d2d353e6dadba155464",
    "oracleFindingCodes": [
      "S06_ORACLE_EXPECTED_IDENTITY_MISMATCH",
      "S06_ORACLE_PNG_METADATA_FORBIDDEN",
      "S06_ORACLE_PNG_SRGB_REQUIRED"
    ],
    "oraclePrimaryCode": "S06_ORACLE_PNG_SRGB_REQUIRED",
    "strictDecision": "non-pass",
    "telemetryComplete": true,
    "workerExitCode": 0,
    "workerExitConfirmed": true,
    "workerExitSignal": null,
    "workerRuntimePayloadSha256": "dbeba889048bc7e9200b99ab0e710b1365c292be267d9bab982e67afad8e8be3"
  },
  "evidenceBoundary": {
    "c1": 0,
    "calibrationAuthorized": false,
    "e1": 0,
    "excludedFromGateB": true,
    "formal": false,
    "g1": 0,
    "gateBDecisionAuthority": false,
    "o1": 0,
    "productSupport": false,
    "r1Pipeline": 0,
    "r1ProductRelease": 0,
    "r1ProductValidation": 0,
    "releaseAllowlist": "none",
    "releaseApproved": 0,
    "releaseRegistered": 0,
    "u1": 0,
    "v1": 0
  },
  "expectedDisposition": "applicable",
  "expectedStableErrorCode": null,
  "finishedAt": "2026-08-15T10:21:28.453Z",
  "idempotencyKeyHash": "2f57df4c298b2e57bf8d8b2841c71e4cd5184b9f1d560cd2ec8dd4a23a02898e",
  "mode": "open-diagnostic",
  "operation": "export",
  "publication": {
    "atomicDirectoryCommit": true,
    "rolePaths": {
      "candidateOutput": "quarantine/export/source.s06.export.diagnostic.003/r3/candidate-output.bin",
      "candidateOutputObservation": "quarantine/export/source.s06.export.diagnostic.003/r3/candidate-output-observation.json",
      "diagnosticEnvelope": "quarantine/export/source.s06.export.diagnostic.003/r3/diagnostic-envelope.json",
      "oracleDiagnostic": "quarantine/export/source.s06.export.diagnostic.003/r3/oracle-diagnostic.json",
      "terminalResult": "quarantine/export/source.s06.export.diagnostic.003/r3/terminal-result.json"
    },
    "rootRelativePath": "quarantine/export/source.s06.export.diagnostic.003/r3"
  },
  "reasonCode": "S06_OUTPUT_ORACLE_REJECTED",
  "requestRef": {
    "contentHash": "61bf1c7ae4a9a8e74b126cd50e159c12284b698788f9eece3bb27a726c06785d",
    "id": "request.open-diagnostic.export.ec69ed400703b349.r3.a1"
  },
  "resultId": "result.2f57df4c298b2e57bf8d8b2841c71e4cd5184b9f1d560cd2ec8dd4a23a02898e",
  "schemaVersion": "run-result.slice06.v0",
  "startedAt": "2026-08-15T10:21:28.294Z",
  "status": "characterized-oracle-non-pass",
  "workerFailureEnvelopeRef": null,
  "workerInvoked": true
}
